{
  "replay_id": "RPL-2026-0001",
  "objective_id": "OBJ-2026-0001",
  "source_trace": "examples/minimal-trace.json",
  "generated_at": "2026-03-21T10:10:00Z",
  "reconstruction_level": "meaningful",
  "summary": "Reconstruction confirms acceptance, execution, and report generation sequence.",
  "referenced_events": ["EVT-1", "EVT-2"]
}
